@id,@label,hasNote,Tipos Colav,Entidad
QH80-2R4E,source code,"Source code is any collection of code, with or without comments, written using a human-readable programming language, usually as plain text. [Source: https://en.wikipedia.org/wiki/Source_code]",,
R60J-J5BD,conference presentation,"A set of slides containing text, tables or figures, designed to communicate ideas or research results, for projection and viewing by an audience at a conference, symposium, seminar, lecture, workshop or other gatherings. [Source: Adapted from http://purl.org/spar/fabio/Presentation]",,
QX5C-AR31,other periodical,"A resource type that is not included in existing terms under the top concept ""Text"". [COAR definition]",,
YZ1N-ZFT9,research protocol,"The protocol is a detailed plan of the research study including a project summary, project description covering the rationale, objectives, methodology, data management and analysis, ethical considerations, gender issues and references. [Source: Adapted from https://www.who.int/publications/i/item/a-practical-guide-for-health-researchers]",,
D97F-VB57,commentary,A commentary is a more in-depth analysis written to draw attention to a work already published. Commentaries are somewhat like “reviews” in that the author presents his or her analysis of a work and why it would be of interest to a specific audience. [Source: https://www.enago.com/academy/perspective-opinion-and-commentary-pieces],,
H9BQ-739P,peer review,"An evaluation of scientific, academic, or professional work by others working in the same field. [Source: Adopted from https://schema.datacite.org/meta/kernel-4.4/doc/DataCite-MetadataKernel_v4.4.pdf]",,
6NC7-GK9S,transcription,"A written record of words spoken in court proceedings or in a speech, interview, broadcast, or sound recording. [Source: Adapted from https://products.abc-clio.com/ODLIS/odlis_t.aspx]",,
H6QP-SC1X,trademark,"A sign used to distinguish the goods or services of one undertaking from those
of others. A trademark may consist of words and combinations of words (for
instance, names or slogans), logos, figures and images, letters, numbers,
sounds, or, in rare instances, smells or moving images, or a combination thereof. [Source: https://www.wipo.int/trademarks/en]",,
F8RT-TJK0,artistic work,"A work of visual arts and performing arts, including musical works; dramatic works; pantomimes and choreographic works; motion picture and other audiovisual works; pictorial, graphic, sculptural and architectural works. Adapted from Law Insider: https://www.lawinsider.com/dictionary/artistic-works",,
RMP5-3GQ6,collection,"An aggregation of resources, which may encompass collections of one resourceType as well as those of mixed types. A collection is described as a group; its parts may also be separately described. https://datacite-metadata-schema.readthedocs.io/en/4.5/appendices/appendix-1/resourceTypeGeneral/#collection",,
YC9F-HGCF,archival collection,A collection of historical records and primary source documents. Documents may be tangible or digital. Adapted from “archive (groupings)” in Getty AAT: https://www.getty.edu/vow/AATFullDisplay?find=maiolica&logic=AND&note=&subjectid=300375748,,
1YTN-RJZE,court documents,"A set of judicial proceedings that record, physically or digitally, and in an orderly fashion, the development of a process or procedural actions so that they may be recorded and examined by the parties. This would include the set of judicial proceedings and any item within that set as a physical or electronic court document. Adapted from https://dpej.rae.es/lema/expediente-judicial with input from https://www.supremecourt.gov/case_documents.aspx",,
GSZA-Y7V7,knowledge organization system,"All types of schemes for organizing information and promoting knowledge management. Knowledge organization systems include classification schemes that organize materials at a general level (such as books on a shelf), subject headings that provide more detailed access, and authority files that control variant versions of key information (such as geographic names and personal names). They also include less-traditional schemes, such as semantic artifacts, semantic networks and ontologies. https://www.clir.org/pubs/reports/pub91/1knowledge/",,
S7R1-K5P0,physical sample,"Physical samples include biological specimens, rock or mineral specimens, soil or sediment cores, plants and seeds, water quality samples, archaeological artefacts, or DNA and human tissue samples. Samples may be used in analyses and can be destroyed in this process, whereas specimens are preserved curated objects that can be continuously studied.
Source: 23 Things Physical Samples https://eprints.gla.ac.uk/309016/1/309016.pdf",,
8KJG-QS0Y,research instrument,"A device, tool or apparatus used to obtain, measure and/or analyze data. Source https://datacite-metadata-schema.readthedocs.io/en/4.5/appendices/appendix-1/resourceTypeGeneral/#instrument",,
43KC-T6DC,magazine article,"An Item appearing in a magazine (a general interest or specific focus periodical). This item is often shorter in length, is submitted by in-house and external authors. Adapted from MAGAZINE Definition & Meaning - Black's Law Dictionary (thelawdictionary.org)",,
DX5J-TA9R,knowledge synthesis protocol,"In the context of systematic reviews and meta-analyses, a protocol is a document that presents an explicit plan for a systematic review. The protocol details the rationale and a priori methodological and analytical approach of the review. https://www.bmj.com/content/349/bmj.g7647",,